{
  "$schema": "../../item.schema.json",
  "title": "Cart Item Detailed",
  "description": "Cart lines with large thumbnails, the line total with any saving, quantity buttons and a remove action.",
  "categories": ["cart"],
  "components": {
    "CartItemDetailed": "Lists the cart's items with price per unit, a quantity stepper and a remove button."
  },
  "recipes": {
    "cart-item-detailed": {
      "composes": ["section-title", "meta", "quiet-action"],
      "base": {
        "display": "flex",
        "flexDirection": "column",
        "gap": "{spacing.5}"
      }
    },
    "cart-item-detailed-image": {
      "base": {
        "extends": "thumbnail",
        "size": "{spacing.24}"
      }
    },
    "cart-item-detailed-line": {
      "base": {
        "gap": "{spacing.4}"
      }
    },
    "cart-item-detailed-quantity": {
      "base": {
        "typography": "{typography.small}",
        "fontWeight": "medium",
        "width": "{spacing.8}"
      }
    }
  }
}
