{
  "$schema": "../../item.schema.json",
  "title": "Cart Compact",
  "description": "A mini cart in a side sheet, with quantity controls, free-shipping progress, the subtotal and checkout.",
  "categories": ["cart"],
  "components": {
    "CartCompact": "Opens a side sheet with the cart's items, quantity controls, free-shipping progress and checkout."
  },
  "recipes": {
    "cart-compact": {
      "composes": ["part-title-lg", "hint", "meta", "note-positive"]
    }
  }
}
